{
  "schemaVersion": "eval-suite.v1",
  "id": "coding-gold",
  "version": "1.0.0",
  "capability": "coding",
  "adapter": "coding_gold_fixture_patch",
  "tiers": ["weekly", "release"],
  "runnerClass": "hosted_linux",
  "networkPolicy": "deny",
  "shards": 4,
  "timeoutSeconds": 300,
  "thresholds": { "minPassedCases": 20 },
  "cases": [
    { "id": "CE-BUG-001" },
    { "id": "CE-BUG-002" },
    { "id": "CE-BUG-003" },
    { "id": "CE-BUG-004" },
    { "id": "CE-BUG-005" },
    { "id": "CE-TEST-001" },
    { "id": "CE-TEST-002" },
    { "id": "CE-TEST-003" },
    { "id": "CE-TEST-004" },
    { "id": "CE-FE-001" },
    { "id": "CE-FE-002" },
    { "id": "CE-FE-003" },
    { "id": "CE-FE-004" },
    { "id": "CE-RUST-001" },
    { "id": "CE-RUST-002" },
    { "id": "CE-RUST-003" },
    { "id": "CE-REV-001" },
    { "id": "CE-REV-002" },
    { "id": "CE-NAV-001" },
    { "id": "CE-NAV-002" }
  ]
}
